SKU	Product Area	Rule Name	Rule ID	Config Reference	Description	Cursor Generated Description	Current Feature ID	Current Feature Name	Action to be taken	Feature Alignment	Updated Description (If needed)	Updates to rule logic (If needed)	Notes	Required changes	Progress
Talent Managment Leader Experience Add-on	Talent Management -Leader Experience	Skill proficiencies	skill_proficiences		Checks whether skill proficiency tracking is configured for Skill Assessments when role skills are enabled in Career Hub.<br><br><h5>Impact of Failure</h5>Without this configuration, tracking employee proficiency in role-related skills during assessments will not function, reducing upskilling effectiveness.	**Purpose:** Ensures skill proficiency levels are configured for Skill Assessments in Career Hub. Proficiency levels (e.g., Beginner, Intermediate, Advanced, Expert) allow employees and managers to track competency progression over time.<br><br>**Impact:** Without proficiency configuration, skill assessments cannot measure or track competency levels, making it impossible to identify skill gaps or measure upskilling progress.<br><br>**To Fix:** Navigate to Admin Console → Talent Management → Career Hub → Skill Assessments. Enable proficiency tracking and configure the proficiency scale (typically 4-5 levels). Ensure proficiency levels are mapped to your organization's competency framework.	skill_assessments_v2_with_role_skills	Skill Assessments v2 with role skills enabled	Update	Assessments 2.0				Alignment	Need More Info
Talent Managment Leader Experience Add-on	Talent Management -Leader Experience	Skill assessments	profile_page_skill_assessments		Checks whether Skill Assessments are configured on the employee profile page, enabling direct access for employees to complete assessments aligned with role skills.<br><br><h5>Impact of Failure</h5>If not configured, employees will not see Skill Assessments on their profiles, reducing participation and tracking.	**Purpose:** Validates that the Skill Assessments tab is configured on the employee profile page, providing a dedicated location for employees to view and complete their skill assessments.<br><br>**Impact:** If not configured, employees must navigate elsewhere to access assessments, reducing visibility and participation rates. This can significantly impact upskilling program adoption.<br><br>**To Fix:** Navigate to Admin Console → Talent Management → Career Hub → Profile Page Configuration. Add 'skill_assessments' to the profile page tabs. Verify the tab appears in the employee's profile navigation.	skill_assessments_v2_with_role_skills	Skill Assessments v2 with role skills enabled	Update	Assessments 2.0				Alignment	Need More Info
Talent Managment Leader Experience Add-on	Talent Management -Leader Experience	Skill proficiencies	skill_proficiences		Checks whether skill proficiency configurations are enabled for Skill Assessments within Career Hub, ensuring proper tracking of skill assessment behaviors.<br><br><h5>Impact of Failure</h5>If not configured, skill proficiency tracking during assessments will not function, impacting employee skill profiling and progress tracking.	**Purpose:** Ensures skill proficiency levels are configured for Skill Assessments in Career Hub. Proficiency levels (e.g., Beginner, Intermediate, Advanced, Expert) allow employees and managers to track competency progression over time.<br><br>**Impact:** Without proficiency configuration, skill assessments cannot measure or track competency levels, making it impossible to identify skill gaps or measure upskilling progress.<br><br>**To Fix:** Navigate to Admin Console → Talent Management → Career Hub → Skill Assessments. Enable proficiency tracking and configure the proficiency scale (typically 4-5 levels). Ensure proficiency levels are mapped to your organization's competency framework.	skill_assessments_v2	Skill Assessments v2	Update	Assessments 2.0				Alignment	Partial Complete
Talent Managment Leader Experience Add-on	Talent Management -Leader Experience	Skill assessments	profile_page_skill_assessments		Checks whether Skill Assessments are configured within the profile page layout, enabling employees to access and complete assessments directly from their profile.<br><br><h5>Impact of Failure</h5>Without this configuration, employees will not see or access Skill Assessments from their profile, limiting skill tracking and upskilling workflows.	**Purpose:** Validates that the Skill Assessments tab is configured on the employee profile page, providing a dedicated location for employees to view and complete their skill assessments.<br><br>**Impact:** If not configured, employees must navigate elsewhere to access assessments, reducing visibility and participation rates. This can significantly impact upskilling program adoption.<br><br>**To Fix:** Navigate to Admin Console → Talent Management → Career Hub → Profile Page Configuration. Add 'skill_assessments' to the profile page tabs. Verify the tab appears in the employee's profile navigation.	skill_assessments_v2	Skill Assessments v2	Update	Assessments 2.0				Alignment	Partial Complete
Talent Managment Leader Experience Add-on	Talent Management -Leader Experience	Skill assessment access check enabled	skill_assessment_default_access		Checks whether access checks for Skill Assessments are enabled in Career Hub, allowing controlled access to assessment workflows.<br><br><h5>Impact of Failure</h5>Without this configuration, skill assessments may not respect access rules, leading to inconsistent user experience.	**Purpose:** Ensures access control is properly configured for Skill Assessments, determining who can view, request, and complete assessments based on organizational hierarchy and role.<br><br>**Impact:** Without proper access configuration, assessments may not respect organizational boundaries, or employees may be unable to access assessments assigned to them.<br><br>**To Fix:** Configure access rules in Admin Console → Talent Management → Skill Assessments → Access Control. Set permissions for employee self-assessment, manager-initiated assessments, and HRBP oversight.	skill_assessments_v2	Skill Assessments v2	Update	Assessments 2.0					Partial Complete
Talent Managment Leader Experience Add-on	Talent Management -Leader Experience	Skill assessment access check enabled	skill_assessment_default_access		Checks whether access checks for Skill Assessments are enabled when role skills are configured, ensuring assessments respect access control and role-based workflows.<br><br><h5>Impact of Failure</h5>Without this configuration, assessments may bypass access control, leading to inconsistencies in who can access skill assessments.	**Purpose:** Ensures access control is properly configured for Skill Assessments, determining who can view, request, and complete assessments based on organizational hierarchy and role.<br><br>**Impact:** Without proper access configuration, assessments may not respect organizational boundaries, or employees may be unable to access assessments assigned to them.<br><br>**To Fix:** Configure access rules in Admin Console → Talent Management → Skill Assessments → Access Control. Set permissions for employee self-assessment, manager-initiated assessments, and HRBP oversight.	skill_assessments_v2_with_role_skills	Skill Assessments v2 with role skills enabled	Update	Assessments 2.0	Checks whether access checks for Skill Assessments are enabled when role skills are configured, ensuring assessments respect access control and role-based workflows.<br><br><h5>Impact of Failure</h5>Without this configuration, assessments may bypass access control, leading to role skills not appearing				Need More Info
Talent Managment Leader Experience Add-on	Talent Management -Leader Experience	Employee Engagement Enabled	employee_engagement_enabled		Checks whether employee engagement tracking is enabled in Career Hub when using Skill Assessments with role skills, allowing for monitoring and improvement of employee participation in upskilling workflows.<br><br><h5>Impact of Failure</h5>If not enabled, engagement tracking will not function, reducing visibility into employee participation in skill development.	**Purpose:** Validates that employee engagement tracking is enabled in Career Hub, allowing the platform to measure and report on employee participation in development activities like upskilling, career planning, and skill assessments.<br><br>**Impact:** Without engagement tracking, organizations cannot measure adoption of TM features, identify disengaged employees, or demonstrate ROI of talent management initiatives.<br><br>**To Fix:** Navigate to Admin Console → Talent Management → Career Hub Base Config. Set 'employee_engagement_enabled' to true. Configure engagement metrics to track (logins, course completions, skill updates, etc.).	skill_assessments_v2_with_role_skills	Skill Assessments v2 with role skills enabled	Update	Assessments 2.0	Checks whether employee engagement tracking is enabled in Career Hub when using Skill Assessments with role skills, allowing for monitoring and improvement of employee participation in skill development.<br><br><h5>Impact of Failure</h5>If not enabled, engagement tracking will not function, reducing visibility into employee participation in skill development.				Need More Info
Talent Managment Core	Talent Management - Core	Upskilling tab exists under own profile page	upskilling_display_config		Checks whether the Upskilling tab is configured to appear under the employee's own profile page, enabling employees to view and manage upskilling plans within Career Hub.<br><br><h5>Impact of Failure</h5>If not configured, employees will not see the Upskilling tab, reducing visibility into upskilling opportunities.	**Purpose:** Ensures the Upskilling tab is visible on the employee profile page, providing access to upskilling plans, recommended courses, and skill development activities.<br><br>**Impact:** If missing, employees cannot view or manage their upskilling plans from their profile, reducing engagement with learning and development initiatives.<br><br>**To Fix:** Navigate to Admin Console → Talent Management → Career Hub → Profile Page. Add 'upskilling' to the tabs configuration. For org-led upskilling, also verify template management is accessible to HRBPs/Talent Admins.	upskilling	Upskilling	Update	Skills Development				alignment	Partial Complete
Talent Managment Core	Talent Management - Core	Profile skills quality	profile_skills_quality		Checks whether at least 75% of employee profiles have at least one skill added, ensuring profiles are enriched for recommendations and skill-based workflows.<br><br><h5>Impact of Failure</h5>Insufficient skills on profiles will reduce the effectiveness of recommendations and insights across Talent Management modules.	**Purpose:** Measures the percentage of employee profiles with at least one skill added. Target threshold: 75% of profiles should have skills.<br><br>**Impact:** Low skill coverage reduces the effectiveness of AI-powered matching, job recommendations, and skill-based analytics. Career Navigator and succession planning depend on skill data.<br><br>**To Fix:** Encourage employees to add skills via Profile Assistant. Use bulk skill import from HRIS. Enable skill inference from job titles and experience. Run engagement campaigns to improve profile completeness.	employee_skills_dashboard	Employee Skills Dashboard	Update	Core Talent Management (Employee Profiles and Career Hub homepage)					Partial Complete
Talent Managment Core	Talent Management - Core	Recommended Jobs	recommended_jobs_filter_list		Ensures the filter list for recommended jobs in Career Hub is configured. This feed shows jobs personalized for the employee based on their profile and preferences.<br><br><h5>Impact of Failure</h5>If not configured, employees may receive irrelevant job recommendations, reducing engagement with the Career Hub.	**Purpose:** Validates that the filter list for recommended jobs is configured, ensuring personalized job recommendations on the Career Hub home page.<br><br>**Impact:** Without filter configuration, job recommendations may be irrelevant or missing entirely.<br><br>**To Fix:** Navigate to Admin Console → Talent Management → Career Hub → Feeds. Configure recommended_jobs with appropriate filters.	recommendation_feeds	Recommendation Feeds	Update	Core Talent Management (Employee Profiles and Career Hub homepage)					Partial Complete
Talent Managment Core	Talent Management - Core	Similar People	similar_people_filter_list		Ensures the filter list for similar people recommendations in Career Hub is configured. This feature shows employees other people with similar current or target titles for networking and exploration.<br><br><h5>Impact of Failure</h5>If not configured, employees may see irrelevant recommendations or fail to see potential peers, reducing the utility of Career Hub.	**Purpose:** Validates that the Similar People recommendation filter is configured, showing employees with similar roles/skills for networking.<br><br>**Impact:** Without configuration, employees cannot discover peers for collaboration and networking.<br><br>**To Fix:** Navigate to Admin Console → Talent Management → Career Hub → Feeds. Configure similar_people with appropriate filters.	recommendation_feeds	Recommendation Feeds	Update	Core Talent Management (Employee Profiles and Career Hub homepage)					Partial Complete
Talent Managment Core	Talent Management - Core	Career Hub Home Page Card Configuration	ta_email_template_variables_cj	Home page feature cards may be disabled. Go to  integrations/career_hub_base_config::product_configs>employee'>Career Hub Base Config</a> and verify:<br>1. In 'home_page_config' > 'cards', enable desired feature cards<br>2. For Mentors: ensure 'recommended_mentors' card is enabled<br>3. For Courses: ensure 'recommended_courses' card is enabled<br>4. For Career Navigator: ensure 'career_navigator_tour' card is enabled<br>5. Check card display order and personalization settings	Ensures that key Career Hub feature cards are enabled and visible on the employee home page, including Mentors, Courses, Career Navigator Tour, and other discovery features.<br><br><h5>Impact of Failure</h5>Important Career Hub features are not visible to employees on their home page, reducing feature discoverability and adoption.	**Purpose:** Validates that email templates use consistent and valid variable placeholders for candidate and job information.<br><br>**Impact:** Invalid variables cause email personalization to fail, showing placeholder text to candidates.<br><br>**To Fix:** Review email templates and ensure all variables match the supported variable list. Use {candidate_name}, {position_title}, {company_name}, etc.			Update	Core Talent Management (Employee Profiles and Career Hub homepage)					Need More Info
Talent Managment Core	Talent Management - Core	Employee Engagement Enabled	employee_engagement_enabled		Checks whether employee engagement features are enabled in Career Hub to track and encourage participation in upskilling and career development workflows.<br><br><h5>Impact of Failure</h5>If not enabled, employee engagement tracking and related workflows will not function, reducing visibility into participation.	**Purpose:** Validates that employee engagement tracking is enabled in Career Hub, allowing the platform to measure and report on employee participation in development activities like upskilling, career planning, and skill assessments.<br><br>**Impact:** Without engagement tracking, organizations cannot measure adoption of TM features, identify disengaged employees, or demonstrate ROI of talent management initiatives.<br><br>**To Fix:** Navigate to Admin Console → Talent Management → Career Hub Base Config. Set 'employee_engagement_enabled' to true. Configure engagement metrics to track (logins, course completions, skill updates, etc.).	skill_assessments_v2	Skill Assessments v2	Update	Core Talent Management (Employee Profiles and Career Hub homepage)	Checks whether employee engagement features are enabled in Career Hub to track and encourage participation in upskilling/development plan workflows.<br><br><h5>Impact of Failure</h5>If not enabled, employee engagement tracking and related workflows will not function, reducing visibility into participation.			desc and align	Partial Complete
Talent Managment Core	Talent Management - Core	Employee Hiring Bands	employee_hiring_bands		Ensures that employee hiring bands are set up and linked to the correct seniority levels in the calibration settings. This helps align employees and roles by level, enabling accurate search, recommendations, and analytics.<br><br><h5>Impact of Failure</h5>Missing or incorrect bands can lead to mismatched job recommendations, broken filters, and inaccurate seniority-based indexing.	**Purpose:** Validates that hiring bands are configured to define role hierarchy. Bands determine job eligibility based on employee level.<br><br>**Impact:** Without hiring bands, job recommendations cannot be filtered by eligibility, and Career Navigator paths may not function correctly.<br><br>**To Fix:** Navigate to Admin Console → Talent Management → Internal Mobility. Configure job_bands with your organization's level structure. Map each band to seniority levels.	base_tm	Basic TM	Update	Core Talent Management (Employee Profiles and Career Hub homepage)	Ensures that employee hiring bands are set up and linked to the correct seniority levels in the calibration settings. This aligns employees and roles by level, enabling accurate search, recommendations, and analytics.<br><br><h5>Impact of Failure</h5>Missing or incorrect bands can lead to mismatched job recommendations, broken filters, inaccurate seniority-based indexing, and will also affect mentorship recommendations if hiring bands are not configured.			desc and align	Partial Complete
Talent Managment Core	Talent Management - Core	Skills across all courses	course_skills_count_rule		Checks whether courses have skills tied to them, which is essential for filtering and recommending courses in the upskilling plan workflow.<br><br><h5>Impact of Failure</h5>Courses without associated skills cannot be recommended accurately, reducing the effectiveness of upskilling recommendations.	**Purpose:** Measures the percentage of courses with skills tagged. Skills on courses enable accurate recommendations for upskilling plans.<br><br>**Impact:** Courses without skills cannot be recommended accurately for skill development, reducing effectiveness of learning recommendations.<br><br>**To Fix:** Tag courses with relevant skills via LMS integration or manual assignment. Use AI to infer skills from course titles and descriptions.	Courses	Courses	Keep as is	Courses					Complete
Talent Managment Core	Talent Management - Core	My courses	my_courses		"Ensures the ""My Courses"" section is available in the Career Hub navigation bar, providing employees with access to assigned, in-progress, and completed courses in one place.<br><br><h5>Impact of Failure</h5>If missing, employees may struggle to track learning progress or locate relevant courses, reducing participation in development initiatives."	"**Purpose:** Validates that the ""My Courses"" section is available in Career Hub navigation, providing a central location for employees to track their learning.<br><br>**Impact:** Without My Courses, employees cannot easily track assigned, in-progress, and completed courses in one place.<br><br>**To Fix:** Navigate to Admin Console → Talent Management → Career Hub → Navigation. Add 'my_courses' to navigation items."	courses	Learning/ Courses	Keep as is	Courses					Complete
Talent Managment Core	Talent Management - Core	Courses explore	explore_course		"Ensures the ""Courses Explore"" feature is enabled, allowing employees to browse and search for courses using various filters to discover learning opportunities aligned with their goals.<br><br><h5>Impact of Failure</h5>If not enabled, employees may struggle to find relevant courses, reducing participation in learning initiatives."	**Purpose:** Validates that Course exploration is enabled, allowing employees to browse and discover learning opportunities.<br><br>**Impact:** Without course exploration, employees cannot discover new learning opportunities aligned with their career goals.<br><br>**To Fix:** Navigate to Admin Console → Talent Management → Career Hub → Explore. Enable course exploration feature.	courses	Learning/ Courses	Keep as is	Courses					Complete
Talent Managment Core	Talent Management - Core	Courses global search	global_search_course		Ensures courses are integrated into Global Search, allowing employees to find relevant courses alongside other entities within the platform.<br><br><h5>Impact of Failure</h5>If not enabled, employees may find it difficult to search for courses, reducing participation in development programs.	**Purpose:** Validates that courses are included in Global Search, allowing employees to find courses alongside other content.<br><br>**Impact:** Without global search integration, employees must navigate separately to find courses, reducing discoverability.<br><br>**To Fix:** Navigate to Admin Console → Talent Management → Global Search. Enable courses in searchable entity types.	courses	Learning/ Courses	Keep as is	Courses					Complete
Talent Managment Core	Talent Management - Core	Skills across all courses	course_skills_count_rule		Tracks the percentage of courses with associated skills, ensuring course suggestions for upskilling plans are relevant and skills-based.<br><br><h5>Impact of Failure</h5>Low skill mapping reduces the effectiveness of course recommendations for upskilling plans.	**Purpose:** Measures the percentage of courses with skills tagged. Skills on courses enable accurate recommendations for upskilling plans.<br><br>**Impact:** Courses without skills cannot be recommended accurately for skill development, reducing effectiveness of learning recommendations.<br><br>**To Fix:** Tag courses with relevant skills via LMS integration or manual assignment. Use AI to infer skills from course titles and descriptions.	courses	Learning/ Courses	Update	Courses	Tracks the percentage of courses with associated skills, ensuring course suggestions for upskilling plans, career navigator paths & course recommendations are relevant and skills-based.<br><br><h5>Impact of Failure</h5>Low skill mapping reduces the effectiveness of course recommendations across TM			desc and align	Partial Complete
Talent Managment Core	Talent Management - Core	More than {{ metric_data_json.min_threshold }}% of employees should have level	employee_level_quality		Checks if most employees have a level defined in their profile, which is essential for seniority inference and accurate role initialization in Career Navigator.<br><br><h5>Impact of Failure</h5>Missing employee levels can break matching, reduce recommendation quality, and disrupt seniority-based workflows.	**Purpose:** Validates that employee profiles have a defined level/grade. Levels are used for seniority inference, role matching, and Career Navigator path recommendations.<br><br>**Impact:** Missing levels affect job eligibility calculations, succession planning accuracy, and internal mobility recommendations. Career Navigator cannot properly initialize roles without level data.<br><br>**To Fix:** Ensure levels are ingested from HRIS. Map HRIS levels to Eightfold's level schema. Verify levels appear in employee profiles. Check level mapping in Admin Console → Internal Mobility.	career_navigator	Career Navigator	Update	Data Health					Need More Info
Talent Managment Core	Talent Management - Core	More than {{ metric_data_json.min_threshold }}% of employees should have their associated levels defined in Internal mobility config	employee_levels_in_internal_mobility_config_quality		Checks if employee levels are defined in the Internal Mobility configuration, which is critical for role hierarchy and accurate matching in Career Navigator.<br><br><h5>Impact of Failure</h5>Missing level configurations can lead to incorrect eligibility calculations and limit internal mobility workflows.	**Purpose:** Validates that employee levels are properly configured in Internal Mobility settings, enabling correct band-based job eligibility.<br><br>**Impact:** Without proper level configuration, employees may not see appropriate job opportunities.<br><br>**To Fix:** Navigate to Admin Console → Talent Management → Internal Mobility. Verify all employee levels are mapped in the configuration.	career_navigator	Career Navigator	Update	Data Health					Need More Info
